{
  "protocol": "saitenka.session/v0",
  "scenario_id": "close-retires-visible-surface",
  "requires": ["session-v0"],
  "given": {
    "capture": ["surface", "termination"],
    "mpv_properties": {"osd-dimensions": {"w": 1280, "h": 720}}
  },
  "when": [
    {"action": "start"},
    {"action": "command", "name": "saitenka-toggle-help"},
    {"action": "drain_until_quiescent", "max_steps": 8},
    {"action": "close"}
  ],
  "expect": {
    "mode": "contains_in_order",
    "observations": [
      {"source": "mpv", "kind": "command", "value": ["surface-present", "surface-1"]},
      {"source": "mpv", "kind": "command", "value": ["surface-absent", "surface-1"]},
      {"source": "adapter", "kind": "terminated"}
    ]
  }
}
